{
  "schemaVersion": 1,
  "inventoryId": "feature-lineage-v1",
  "target": {
    "sourceRepository": "nexu-io/open-design",
    "sourceUrl": "https://github.com/nexu-io/open-design.git",
    "pinnedImport": "05f5b33ef59f078df10ac1125986e00e4a796cf3",
    "targetCommit": "a554d017c8fa12d8913354ba6cf792d26d0c3b54",
    "expectedCommitCount": 98,
    "membershipOrder": "git log -n 98 <target>"
  },
  "canonicalFeatureIds": [
    "language-modes",
    "dialog-emoji-toggle",
    "school-mode",
    "narration",
    "scheduled-settings",
    "dim-sum-surprise",
    "regex-builders",
    "notification-centre",
    "appearance-editors",
    "tabbed-navigation",
    "offline-documentation",
    "command-palette",
    "destructive-confirmation",
    "local-history",
    "changelog-viewer",
    "external-editor",
    "exports",
    "bulk-actions",
    "accessibility-responsive-sizing",
    "personal-vocabulary-upload",
    "toy-locks-authentication",
    "unlock-ladder",
    "shared-link-embed",
    "adhd-modes",
    "browser-download-surfaces",
    "app-logo-customization",
    "file-converter",
    "ollama-suite-manager",
    "status-hub",
    "front-screen-provenance"
  ],
  "lineageCommits": [
    {
      "order": 1,
      "sha": "a554d017c8fa12d8913354ba6cf792d26d0c3b54",
      "subject": "fix(web): render fixed-stage recent deck covers (#7556)"
    },
    {
      "order": 2,
      "sha": "f9f83f7476800792cf854c15fedcf46ef9cfdc8b",
      "subject": "fix(web): ignore commented slide tags in covers (#7558)"
    },
    {
      "order": 3,
      "sha": "62b7c66f3e9663312d9c26a8a51dca0f9ce93478",
      "subject": "fix(web): answer one inline question form exactly once (#7512)"
    },
    {
      "order": 4,
      "sha": "44f0e44e9d224ab790ccdfe760e9b9d79a894b14",
      "subject": "fix(daemon): preserve ACP startup diagnostics (#6267)"
    },
    {
      "order": 5,
      "sha": "63e72536e9eb8601e6af7ad746e6971f290bca9f",
      "subject": "fix(daemon): make OD Next snapshots safe on Windows (#7531)"
    },
    {
      "order": 6,
      "sha": "2aeb4c0d18a08eb591afc56c30a969e5fc641c1f",
      "subject": "fix(web): keep top-right controls clickable on first launch (#7535)"
    },
    {
      "order": 7,
      "sha": "df9cabb0b5b620038b7b97c7c0d2cfaa82395b56",
      "subject": "fix(daemon): honor selected examples on ordinary runs (#7533)"
    },
    {
      "order": 8,
      "sha": "d4e1b47024e74ef6656f6635f5a3f044dbadbc17",
      "subject": "fix(web): remove the \"use the system automatic scenario\" header entry (#7505)"
    },
    {
      "order": 9,
      "sha": "3af55e9f2243ebb92258f2f85efc4de814d6bb16",
      "subject": "fix(daemon): stop blocking a strategy task whose clarification form renders (#7509)"
    },
    {
      "order": 10,
      "sha": "1e34ca4059d5c6ca64ea32bde6d1d590a1d90518",
      "subject": "fix(daemon,web): report analytics for daemon-started Runs and mid-write Labs toggles (#7514)"
    },
    {
      "order": 11,
      "sha": "35edb37d60c8ec73e34174f1608f8833f461f8b4",
      "subject": "fix(media): preserve bound Workspace billing scope (#7504)"
    },
    {
      "order": 12,
      "sha": "eef3f10ecd0d8e25a7f36f6c13aa265b9f889f94",
      "subject": "test(e2e): quarantine workspace role convergence race (#7493)"
    },
    {
      "order": 13,
      "sha": "f2e1bec689e039d98e2d34ff06e6eff7f74dbeb5",
      "subject": "test(e2e): close recent release coverage gaps (#7441)"
    },
    {
      "order": 14,
      "sha": "d723a7e0bf27ec95c419fc7d57bcf8d7198e6b13",
      "subject": "fix(desktop,web): packaged-only opendesign:// registration, signed-in-only campaign badge (#7479)"
    },
    {
      "order": 15,
      "sha": "664f35af97966afe11bb909ec8469845ce661750",
      "subject": "fix(web): localize Go sunset preset dialog (#7477)"
    },
    {
      "order": 16,
      "sha": "2828a086c8cd019011fa07b69e5d98e34ea4283f",
      "subject": "feat(web): add an Open Design Labs settings page with the Design Harness switch (#7445)"
    },
    {
      "order": 17,
      "sha": "75e231ec7e45b3dbe95ee572f52aaaebb0d57ab4",
      "subject": "fix(web): keep signed-out updater in top-right cluster (#7482)"
    },
    {
      "order": 18,
      "sha": "586469938e788886bfc2135fb037c3d11467307c",
      "subject": "fix(daemon): add Fable and the Claude 5 ids to the model picker (#7401)"
    },
    {
      "order": 19,
      "sha": "3bda981d459bc896a210a77e0249650ec4a7aea2",
      "subject": "docs: repair stale TOC anchors in plugins-spec (en + zh-CN) (#7365)"
    },
    {
      "order": 20,
      "sha": "e13346decf4673132226417ec27703e48677c3d1",
      "subject": "fix(daemon): stop AMR prompt after model rejection (#7458)"
    },
    {
      "order": 21,
      "sha": "7f65c795d9b4106db2dcf3ef92c585a934b6ee13",
      "subject": "refactor: share one structural HTML injection-point locator (#7422)"
    },
    {
      "order": 22,
      "sha": "1c2e91163486adcb5e9688a09f4474b7cd8bcc17",
      "subject": "fix(daemon): pass noninteractive permission bypass to Antigravity (#7316)"
    },
    {
      "order": 23,
      "sha": "b7465aa57a0cd3e17c5fa22813ebefa4a6512473",
      "subject": "fix(amr): classify membership concurrency limits (#7429)"
    },
    {
      "order": 24,
      "sha": "cd6920f96362375235dc0f5a316baa8d5c9fbd15",
      "subject": "feat(prompts): require real imagery for factual referents (#7436)"
    },
    {
      "order": 25,
      "sha": "3c05f82c79810f840de3890cd38117d5e0a35451",
      "subject": "fix(daemon): report terminal AMR Runs to Vela (#7424)"
    },
    {
      "order": 26,
      "sha": "8d5e90b1e96601c0bef9bcb0fc6ac71c407ebb96",
      "subject": "fix(web): keep asking for a project scope the daemon has not materialized yet (#7464)"
    },
    {
      "order": 27,
      "sha": "00715e2cd2f60949351d84c501ff26baa3430d1b",
      "subject": "fix(landing): preserve attribution across locale redirects (#7447)"
    },
    {
      "order": 28,
      "sha": "7e365acc4d8b3bcf25ae8306ef027d792cb955db",
      "subject": "fix(daemon): locate URL preview injection points structurally (#7421)"
    },
    {
      "order": 29,
      "sha": "9881cff70e02be86c2a58130af512011ba23d4af",
      "subject": "fix(web): match Go Plan sunset message prefixes (#7453)"
    },
    {
      "order": 30,
      "sha": "0dc31fef636c0f3e0e388a5e4d191d94a725e011",
      "subject": "fix(daemon): silence ACP process trees before terminal (#7432)"
    },
    {
      "order": 31,
      "sha": "54f9cd236adfcabc351e0d53ad4aeb80ce734e24",
      "subject": "fix(web): answer /api paths with a connection failure when no daemon origin is configured (#7399)"
    },
    {
      "order": 32,
      "sha": "52d9a806f992531139b28ff6b8457a2ba9fb784e",
      "subject": "fix(web): keep Settings Team balance workspace-scoped (#7384)"
    },
    {
      "order": 33,
      "sha": "c7d0dcceb184e4dce4062345e02dc7bb38fecd1c",
      "subject": "fix(web): preserve BYOK after Cloud sign-out (#7437)"
    },
    {
      "order": 34,
      "sha": "d88941ba0e3ef5e4ddde2c6307382ce931eed132",
      "subject": "chore(release): bump main to 0.21.1 ahead of stable 0.21.0 (#7407)"
    },
    {
      "order": 35,
      "sha": "4076a7713556d9404123fb4b9c0b120cb24a7726",
      "subject": "fix(web): allow signed-out Local CLI and BYOK onboarding (#7381)"
    },
    {
      "order": 36,
      "sha": "ebb5b24c0787c74618e9425eeb019c702b763f65",
      "subject": "feat(web): show targeted Go Plan sunset notice (#7430)"
    },
    {
      "order": 37,
      "sha": "53e78ac16fa9ab28b4eea7027ee0d50aa20ec1b8",
      "subject": "perf(collab): make background materialization volume observable (#7433)"
    },
    {
      "order": 38,
      "sha": "f888d72d5f1a6e486bf0448ef171b4e452b1e58f",
      "subject": "fix(web): keep home tabs active on image switch (#7375)"
    },
    {
      "order": 39,
      "sha": "2642b50a8ac5eeeb95fa91fd9168ae9b75345e97",
      "subject": "fix(classification): empty_output close reason must not outrank RATE_LIMITED or upstream signals (#7248)"
    },
    {
      "order": 40,
      "sha": "a8ec5784eb13a248f5ff3586800819fa070ea250",
      "subject": "perf(web): stop the hidden Automations tab fetching on launch (#7413)"
    },
    {
      "order": 41,
      "sha": "7965b75027ecf4b51c4477386199f5546dd9b498",
      "subject": "perf(web): collapse the launch burst of catalog reads (#7408)"
    },
    {
      "order": 42,
      "sha": "2856f87e8cc49ad00d3c9b7f7615a98968f0dd9c",
      "subject": "feat(collab): add an opt-in cumulative ceiling for background content pulls (#7403)"
    },
    {
      "order": 43,
      "sha": "d5aa100291f615d418fe4e027aa782eb89b5d76c",
      "subject": "perf(collab): serve the team-project display read from its own cache (#7398)"
    },
    {
      "order": 44,
      "sha": "aa424df27d3b93470b9ba57cb61510404d41ebd0",
      "subject": "feat(analytics): attribute project editing events (#7335)"
    },
    {
      "order": 45,
      "sha": "1246ca3d67c762fea1101a396185652dfdd971bf",
      "subject": "test(daemon): stop the telemetry-sink spec reading a real AMR login (#7414)"
    },
    {
      "order": 46,
      "sha": "9cac9d6fc7a3d52f1ec853306c200fee658ab263",
      "subject": "fix(collab): stop reporting cancelled team pulls as failures (#7405)"
    },
    {
      "order": 47,
      "sha": "7a0103394fab2348fd5baab570d08442195fd62e",
      "subject": "feat(web): measure a collapsed deck stage in the preview bridge (#7366)"
    },
    {
      "order": 48,
      "sha": "710c0a028bd57bb96e9d4586cceb71dfd8c7f71f",
      "subject": "fix(web): stop the slash command palette from squashing its rows (#7368)"
    },
    {
      "order": 49,
      "sha": "4831471254e3ff0867b0bf89a93cf9558bdb3d76",
      "subject": "fix(web): keep resize hitbox off chat scroll edge (#7324)"
    },
    {
      "order": 50,
      "sha": "443fcbd5f90f0a6c0e95e0f2a6a8a37723781cc7",
      "subject": "docs(release): add 0.21.0 release notes (#7391)"
    },
    {